[
  {
    "provider": "openrouter",
    "model": "openrouter/elephant-alpha",
    "input_price_per_million_usd": 0.0,
    "output_price_per_million_usd": 0.0,
    "unit": "per_million_tokens",
    "last_updated": "2026-04-21",
    "source": "openrouter",
    "source_url": "https://openrouter.ai/api/v1/models",
    "metadata": {
      "context_length": 262144,
      "raw_pricing": {
        "prompt": "0",
        "completion": "0"
      }
    }
  },
  {
    "provider": "google",
    "model": "google/gemma-4-26b-a4b-it:free",
    "input_price_per_million_usd": 0.0,
    "output_price_per_million_usd": 0.0,
    "unit": "per_million_tokens",
    "last_updated": "2026-04-21",
    "source": "openrouter",
    "source_url": "https://openrouter.ai/api/v1/models",
    "metadata": {
      "context_length": 262144,
      "raw_pricing": {
        "prompt": "0",
        "completion": "0"
      }
    }
  },
  {
    "provider": "google",
    "model": "google/gemma-4-31b-it:free",
    "input_price_per_million_usd": 0.0,
    "output_price_per_million_usd": 0.0,
    "unit": "per_million_tokens",
    "last_updated": "2026-04-21",
    "source": "openrouter",
    "source_url": "https://openrouter.ai/api/v1/models",
    "metadata": {
      "context_length": 262144,
      "raw_pricing": {
        "prompt": "0",
        "completion": "0"
      }
    }
  },
  {
    "provider": "google",
    "model": "google/lyria-3-pro-preview",
    "input_price_per_million_usd": 0.0,
    "output_price_per_million_usd": 0.0,
    "unit": "per_million_tokens",
    "last_updated": "2026-04-21",
    "source": "openrouter",
    "source_url": "https://openrouter.ai/api/v1/models",
    "metadata": {
      "context_length": 1048576,
      "raw_pricing": {
        "prompt": "0",
        "completion": "0"
      }
    }
  },
  {
    "provider": "google",
    "model": "google/lyria-3-clip-preview",
    "input_price_per_million_usd": 0.0,
    "output_price_per_million_usd": 0.0,
    "unit": "per_million_tokens",
    "last_updated": "2026-04-21",
    "source": "openrouter",
    "source_url": "https://openrouter.ai/api/v1/models",
    "metadata": {
      "context_length": 1048576,
      "raw_pricing": {
        "prompt": "0",
        "completion": "0"
      }
    }
  },
  {
    "provider": "openai",
    "model": "openai/gpt-5.4-nano",
    "input_price_per_million_usd": 0.19999999999999998,
    "output_price_per_million_usd": 1.25,
    "unit": "per_million_tokens",
    "last_updated": "2026-04-21",
    "source": "openrouter",
    "source_url": "https://openrouter.ai/api/v1/models",
    "metadata": {
      "context_length": 400000,
      "raw_pricing": {
        "prompt": "0.0000002",
        "completion": "0.00000125",
        "web_search": "0.01",
        "input_cache_read": "0.00000002"
      }
    }
  },
  {
    "provider": "openai",
    "model": "openai/gpt-5.4-mini",
    "input_price_per_million_usd": 0.75,
    "output_price_per_million_usd": 4.5,
    "unit": "per_million_tokens",
    "last_updated": "2026-04-21",
    "source": "openrouter",
    "source_url": "https://openrouter.ai/api/v1/models",
    "metadata": {
      "context_length": 400000,
      "raw_pricing": {
        "prompt": "0.00000075",
        "completion": "0.0000045",
        "web_search": "0.01",
        "input_cache_read": "0.000000075"
      }
    }
  },
  {
    "provider": "nvidia",
    "model": "nvidia/nemotron-3-super-120b-a12b:free",
    "input_price_per_million_usd": 0.0,
    "output_price_per_million_usd": 0.0,
    "unit": "per_million_tokens",
    "last_updated": "2026-04-21",
    "source": "openrouter",
    "source_url": "https://openrouter.ai/api/v1/models",
    "metadata": {
      "context_length": 262144,
      "raw_pricing": {
        "prompt": "0",
        "completion": "0"
      }
    }
  },
  {
    "provider": "openai",
    "model": "openai/gpt-5.4-pro",
    "input_price_per_million_usd": 30.0,
    "output_price_per_million_usd": 180.0,
    "unit": "per_million_tokens",
    "last_updated": "2026-04-21",
    "source": "openrouter",
    "source_url": "https://openrouter.ai/api/v1/models",
    "metadata": {
      "context_length": 1050000,
      "raw_pricing": {
        "prompt": "0.00003",
        "completion": "0.00018",
        "web_search": "0.01"
      }
    }
  },
  {
    "provider": "openai",
    "model": "openai/gpt-5.5",
    "input_price_per_million_usd": 5.0,
    "output_price_per_million_usd": 30.0,
    "unit": "per_million_tokens",
    "last_updated": "2026-04-29",
    "source": "openai",
    "source_url": "https://developers.openai.com/api/docs/models/gpt-5.5",
    "metadata": {
      "context_length": 1050000,
      "max_output_tokens": 128000,
      "cached_input_price_per_million_usd": 0.5,
      "knowledge_cutoff": "2025-12-01",
      "raw_pricing": {
        "prompt": "0.000005",
        "completion": "0.00003",
        "input_cache_read": "0.0000005"
      }
    }
  },
  {
    "provider": "openai",
    "model": "openai/gpt-5.5-pro",
    "input_price_per_million_usd": 30.0,
    "output_price_per_million_usd": 180.0,
    "unit": "per_million_tokens",
    "last_updated": "2026-04-29",
    "source": "openai",
    "source_url": "https://developers.openai.com/api/docs/models/gpt-5.5-pro",
    "metadata": {
      "context_length": 1050000,
      "max_output_tokens": 128000,
      "knowledge_cutoff": "2025-12-01",
      "raw_pricing": {
        "prompt": "0.00003",
        "completion": "0.00018"
      }
    }
  },
  {
    "provider": "openai",
    "model": "openai/gpt-5.4",
    "input_price_per_million_usd": 2.5,
    "output_price_per_million_usd": 15.0,
    "unit": "per_million_tokens",
    "last_updated": "2026-04-21",
    "source": "openrouter",
    "source_url": "https://openrouter.ai/api/v1/models",
    "metadata": {
      "context_length": 1050000,
      "raw_pricing": {
        "prompt": "0.0000025",
        "completion": "0.000015",
        "web_search": "0.01",
        "input_cache_read": "0.00000025"
      }
    }
  },
  {
    "provider": "openai",
    "model": "openai/gpt-5.3-chat",
    "input_price_per_million_usd": 1.75,
    "output_price_per_million_usd": 14.0,
    "unit": "per_million_tokens",
    "last_updated": "2026-04-21",
    "source": "openrouter",
    "source_url": "https://openrouter.ai/api/v1/models",
    "metadata": {
      "context_length": 128000,
      "raw_pricing": {
        "prompt": "0.00000175",
        "completion": "0.000014",
        "web_search": "0.1",
        "input_cache_read": "0.000000175"
      }
    }
  },
  {
    "provider": "openai",
    "model": "openai/gpt-5.3-codex",
    "input_price_per_million_usd": 1.75,
    "output_price_per_million_usd": 14.0,
    "unit": "per_million_tokens",
    "last_updated": "2026-04-21",
    "source": "openrouter",
    "source_url": "https://openrouter.ai/api/v1/models",
    "metadata": {
      "context_length": 400000,
      "raw_pricing": {
        "prompt": "0.00000175",
        "completion": "0.000014",
        "web_search": "0.01",
        "input_cache_read": "0.000000175"
      }
    }
  },
  {
    "provider": "minimax",
    "model": "minimax/minimax-m2.5:free",
    "input_price_per_million_usd": 0.0,
    "output_price_per_million_usd": 0.0,
    "unit": "per_million_tokens",
    "last_updated": "2026-04-21",
    "source": "openrouter",
    "source_url": "https://openrouter.ai/api/v1/models",
    "metadata": {
      "context_length": 196608,
      "raw_pricing": {
        "prompt": "0",
        "completion": "0"
      }
    }
  },
  {
    "provider": "openrouter",
    "model": "openrouter/free",
    "input_price_per_million_usd": 0.0,
    "output_price_per_million_usd": 0.0,
    "unit": "per_million_tokens",
    "last_updated": "2026-04-21",
    "source": "openrouter",
    "source_url": "https://openrouter.ai/api/v1/models",
    "metadata": {
      "context_length": 200000,
      "raw_pricing": {
        "prompt": "0",
        "completion": "0"
      }
    }
  },
  {
    "provider": "arcee-ai",
    "model": "arcee-ai/trinity-large-preview:free",
    "input_price_per_million_usd": 0.0,
    "output_price_per_million_usd": 0.0,
    "unit": "per_million_tokens",
    "last_updated": "2026-04-21",
    "source": "openrouter",
    "source_url": "https://openrouter.ai/api/v1/models",
    "metadata": {
      "context_length": 131000,
      "raw_pricing": {
        "prompt": "0",
        "completion": "0"
      }
    }
  },
  {
    "provider": "liquid",
    "model": "liquid/lfm-2.5-1.2b-thinking:free",
    "input_price_per_million_usd": 0.0,
    "output_price_per_million_usd": 0.0,
    "unit": "per_million_tokens",
    "last_updated": "2026-04-21",
    "source": "openrouter",
    "source_url": "https://openrouter.ai/api/v1/models",
    "metadata": {
      "context_length": 32768,
      "raw_pricing": {
        "prompt": "0",
        "completion": "0"
      }
    }
  },
  {
    "provider": "liquid",
    "model": "liquid/lfm-2.5-1.2b-instruct:free",
    "input_price_per_million_usd": 0.0,
    "output_price_per_million_usd": 0.0,
    "unit": "per_million_tokens",
    "last_updated": "2026-04-21",
    "source": "openrouter",
    "source_url": "https://openrouter.ai/api/v1/models",
    "metadata": {
      "context_length": 32768,
      "raw_pricing": {
        "prompt": "0",
        "completion": "0"
      }
    }
  },
  {
    "provider": "openai",
    "model": "openai/gpt-audio",
    "input_price_per_million_usd": 2.5,
    "output_price_per_million_usd": 10.0,
    "unit": "per_million_tokens",
    "last_updated": "2026-04-21",
    "source": "openrouter",
    "source_url": "https://openrouter.ai/api/v1/models",
    "metadata": {
      "context_length": 128000,
      "raw_pricing": {
        "prompt": "0.0000025",
        "completion": "0.00001",
        "audio": "0.000032"
      }
    }
  },
  {
    "provider": "openai",
    "model": "openai/gpt-audio-mini",
    "input_price_per_million_usd": 0.6,
    "output_price_per_million_usd": 2.4,
    "unit": "per_million_tokens",
    "last_updated": "2026-04-21",